{"ability_id":"core.example.heavy_strike","ability_version":"1.0.0","components":[{"execution_class":null,"expression_metrics":{"depth":3,"nodes":11,"references":["actor.stats.energy_output","actor.stats.physical_capability"]},"id":"strike","output":{"action":{"attack":{"accuracy":{"const":54},"area":{"dimensions":{},"falloff":"none","shape":"point"},"batch_safety":"AUTO","channels":{"normal":1},"delivery":"projectile","interrupt_resistance":0,"penetration":0.2,"power":{"args":[{"args":[{"ref":"actor.stats.physical_capability"},{"const":1.1}],"op":"MULTIPLY"},{"args":[{"ref":"actor.stats.energy_output"},{"const":0.2}],"op":"MULTIPLY"}],"op":"ADD"},"quantity":{"const":1},"range":50,"speed":{"const":48},"stability_impact":10,"status_effects":[],"targeting":{"allocations":[],"mode":"SINGLE"}},"cooldown":null,"costs":[{"amount":{"const":20},"mode":"PER_ACTION","per_hit_amount":0,"resource":"energy","timing":"reserve","upfront_amount":0}],"depends_on":[],"effects":{"displacements":[],"status_removals":[]},"extension_payload":{},"kind":"attack","modifiers":[],"tags":["ability"],"timing":{"declared_at":0,"duration_seconds":1,"interrupt_window_seconds":0.25,"priority":0}}},"template":"ATTACK","when":null}],"constants":{},"cooldown":{"duration":1,"key":"core.example.heavy_strike","starts":"ON_USE","unit":"TURN"},"definition_hash":"6e5d3c72b22e45661587178acbaae05473f7ab9d94692da3b8d80cf7f0606e73","diagnostics":[],"limitations":[],"mechanical_hash":"09f0cbf94216f317a2e9e72710eeb8164af5a05607acb4a2313a99b33be3e5bc","namespace":"core","parameters":{},"parser_version":"0.4.0","registry_hashes":{"body_penetration_compatibility":"3b6ba55b1a3c483179a643608d9aa8176026b06b956b60b43e5eca002c3d75c5","commitment_delays_ms":"47d79ecd9c40c10dbb0c7951c80617659a51f657f665b5e16b1b96f7d5ae8e45","defense_sources":"f8b2650e30ebf34a2c753a1b7bf1c1148ddbc6112d1af6d325ccf8dca4006434","status_definitions":"d45e5b2b9b2165d5024877ede16b3ef64059bebc4f8d98e598012ea2f7f09983"},"requirements":[],"ruleset_version":"0.3","semantic_aliases":{"en":["Heavy Strike","power strike"],"es":["Heavy Strike","golpe fuerte","ataque potente"]},"strategy_fragments":[],"variants":{}}
